{
  "$schema": "https://json-schema.org/draft/2020-12/schema",
  "$id": "https://docs.oasis-open.org/ubl/2/json/schemas/UBL-DigitalAgreement-2",
  "description": "A document used to support business parties agreeing on a set of digital processes, terms and conditions to ensure interoperability.",
  "type": "object",
  "properties": {
    "UBLEntity": {
      "const": "https://docs.oasis-open.org/ubl/2/json/schemas/UBL-DigitalAgreement-2",
      "description": "Identifies the JSON schema governing this instance."
    },
    "UBLExtensions": {
      "$ref": "https://docs.oasis-open.org/ubl/2/json/schemas/CommonExtensionComponents-2#/$defs/UBLExtensionsType"
    },
    "UBLVersionID": {
      "$ref": "https://docs.oasis-open.org/ubl/2/json/schemas/CommonBasicComponents-2#/$defs/UBLVersionID"
    },
    "CustomizationID": {
      "$ref": "https://docs.oasis-open.org/ubl/2/json/schemas/CommonBasicComponents-2#/$defs/CustomizationID"
    },
    "ProfileID": {
      "$ref": "https://docs.oasis-open.org/ubl/2/json/schemas/CommonBasicComponents-2#/$defs/ProfileID"
    },
    "ProfileExecutionID": {
      "$ref": "https://docs.oasis-open.org/ubl/2/json/schemas/CommonBasicComponents-2#/$defs/ProfileExecutionID"
    },
    "ID": {
      "$ref": "https://docs.oasis-open.org/ubl/2/json/schemas/CommonBasicComponents-2#/$defs/ID"
    },
    "UUID": {
      "$ref": "https://docs.oasis-open.org/ubl/2/json/schemas/CommonBasicComponents-2#/$defs/UUID"
    },
    "IssueDate": {
      "$ref": "https://docs.oasis-open.org/ubl/2/json/schemas/CommonBasicComponents-2#/$defs/IssueDate"
    },
    "IssueTime": {
      "$ref": "https://docs.oasis-open.org/ubl/2/json/schemas/CommonBasicComponents-2#/$defs/IssueTime"
    },
    "AgreementTypeCode": {
      "$ref": "https://docs.oasis-open.org/ubl/2/json/schemas/CommonBasicComponents-2#/$defs/AgreementTypeCode"
    },
    "VersionID": {
      "$ref": "https://docs.oasis-open.org/ubl/2/json/schemas/CommonBasicComponents-2#/$defs/VersionID"
    },
    "PreviousVersionID": {
      "$ref": "https://docs.oasis-open.org/ubl/2/json/schemas/CommonBasicComponents-2#/$defs/PreviousVersionID"
    },
    "RequiredResponseMessageLevelCode": {
      "$ref": "https://docs.oasis-open.org/ubl/2/json/schemas/CommonBasicComponents-2#/$defs/RequiredResponseMessageLevelCode"
    },
    "Signature": {
      "oneOf": [
        {
          "$ref": "https://docs.oasis-open.org/ubl/2/json/schemas/CommonAggregateComponents-2#/$defs/SignatureType"
        },
        {
          "type": "array",
          "items": {
            "$ref": "https://docs.oasis-open.org/ubl/2/json/schemas/CommonAggregateComponents-2#/$defs/SignatureType"
          },
          "minItems": 1
        }
      ]
    },
    "GovernorParty": {
      "$ref": "https://docs.oasis-open.org/ubl/2/json/schemas/CommonAggregateComponents-2#/$defs/PartyType"
    },
    "ParticipantParty": {
      "oneOf": [
        {
          "$ref": "https://docs.oasis-open.org/ubl/2/json/schemas/CommonAggregateComponents-2#/$defs/ParticipantPartyType"
        },
        {
          "type": "array",
          "items": {
            "$ref": "https://docs.oasis-open.org/ubl/2/json/schemas/CommonAggregateComponents-2#/$defs/ParticipantPartyType"
          },
          "minItems": 1
        }
      ]
    },
    "AgreementCountry": {
      "oneOf": [
        {
          "$ref": "https://docs.oasis-open.org/ubl/2/json/schemas/CommonAggregateComponents-2#/$defs/CountryType"
        },
        {
          "type": "array",
          "items": {
            "$ref": "https://docs.oasis-open.org/ubl/2/json/schemas/CommonAggregateComponents-2#/$defs/CountryType"
          },
          "minItems": 1
        }
      ]
    },
    "RequiredCertificationDocumentReference": {
      "oneOf": [
        {
          "$ref": "https://docs.oasis-open.org/ubl/2/json/schemas/CommonAggregateComponents-2#/$defs/DocumentReferenceType"
        },
        {
          "type": "array",
          "items": {
            "$ref": "https://docs.oasis-open.org/ubl/2/json/schemas/CommonAggregateComponents-2#/$defs/DocumentReferenceType"
          },
          "minItems": 1
        }
      ]
    },
    "DigitalAgreementTerms": {
      "$ref": "https://docs.oasis-open.org/ubl/2/json/schemas/CommonAggregateComponents-2#/$defs/DigitalAgreementTermsType"
    },
    "DigitalProcess": {
      "oneOf": [
        {
          "$ref": "https://docs.oasis-open.org/ubl/2/json/schemas/CommonAggregateComponents-2#/$defs/DigitalProcessType"
        },
        {
          "type": "array",
          "items": {
            "$ref": "https://docs.oasis-open.org/ubl/2/json/schemas/CommonAggregateComponents-2#/$defs/DigitalProcessType"
          },
          "minItems": 1
        }
      ]
    }
  },
  "required": [
    "UBLEntity",
    "ID",
    "IssueDate",
    "VersionID",
    "ParticipantParty",
    "DigitalProcess"
  ],
  "additionalProperties": false,
  "minProperties": 1,
  "title": "Digital Agreement. Details"
}
